<?xml version="1.0" encoding="UTF-8"?>
<xs:schema attributeFormDefault="unqualified" elementFormDefault="qualified" xmlns:xs="http://www.w3.org/2001/XMLSchema">
  <xs:element name="clasificacion" type="clasificacionType"/>
  <xs:complexType name="equipoType">
    <xs:sequence>
      <xs:element type="xs:string" name="nombre"/>
      <xs:element type="xs:string" name="puntos"/>
    </xs:sequence>
    <xs:attribute type="xs:string" name="id" use="optional"/>
  </xs:complexType>
  <xs:complexType name="clasificacionType">
    <xs:sequence>
      <xs:element type="equipoType" name="equipo" maxOccurs="unbounded" minOccurs="0"/>
    </xs:sequence>
  </xs:complexType>
</xs:schema>