<?xml version="1.0" encoding="UTF-8"?>
<clasificacion
        xmlns:xs="http://www.w3.org/2001/XMLSchema-instance"
        xs:noNamespaceSchemaLocation="clasificacion2.xsd">

    <equipo id="01" >
        <nombre></nombre>
        <puntos></puntos>
    </equipo>

    <equipo id="02">
        <nombre></nombre>
        <puntos></puntos>
    </equipo>

    <equipo id="03">
        <nombre></nombre>
        <puntos></puntos>
    </equipo>

</clasificacion>